{
  "cases": [
    {
      "case_id": "simple_project_workspace_index",
      "error": null,
      "fixture_index": {
        "mail": {
          "account_ids": [],
          "messages_by_external_id": {}
        },
        "matters": {
          "matter_ids": []
        },
        "workspaces": [
          {
            "indexed_chunks": 20,
            "indexed_files": 5,
            "status": "completed",
            "workspace_id": "ws_829af362da"
          }
        ]
      },
      "log": {
        "exists": false,
        "json_parse_errors": [],
        "missing_sections": [],
        "path": null
      },
      "metrics": [
        {
          "details": {
            "error": null
          },
          "name": "no_runtime_error",
          "passed": true,
          "score": 1.0,
          "weight": 2.0
        },
        {
          "details": {
            "missing": []
          },
          "name": "output_contains_all",
          "passed": true,
          "score": 1.0,
          "weight": 2.0
        },
        {
          "details": {
            "actual": 5,
            "minimum": 4
          },
          "name": "workspace_min_files",
          "passed": true,
          "score": 1.0,
          "weight": 1.0
        },
        {
          "details": {
            "actual": 20,
            "minimum": 4
          },
          "name": "workspace_min_chunks",
          "passed": true,
          "score": 1.0,
          "weight": 1.0
        },
        {
          "details": {
            "tool_event_count": 0
          },
          "name": "tool_success_rate",
          "passed": true,
          "score": 1.0,
          "weight": 1.0
        },
        {
          "details": {
            "actual": 0,
            "maximum": 0
          },
          "name": "schema_rejection_count",
          "passed": true,
          "score": 1.0,
          "weight": 1.0
        },
        {
          "details": {
            "actual": 0,
            "maximum": null
          },
          "name": "llm_call_count",
          "passed": true,
          "score": 1.0,
          "weight": 1.0
        },
        {
          "details": {
            "actual": 0,
            "maximum": null
          },
          "name": "reported_token_total",
          "passed": true,
          "score": 1.0,
          "weight": 1.0
        },
        {
          "details": {
            "actual": 440.15,
            "maximum": 5000
          },
          "name": "wall_time_ms",
          "passed": true,
          "score": 1.0,
          "weight": 1.0
        }
      ],
      "name": "simple_project_workspace_index",
      "passed": true,
      "request": {
        "session_id": "eval_workspace_context_simple_project_workspace_index",
        "user_input": "Index eval simple project workspace."
      },
      "result": {
        "operation": "workspace_index",
        "output": {
          "indexed_chunks": 20,
          "indexed_files": 5,
          "status": "completed",
          "workspace_id": "ws_829af362da"
        }
      },
      "score": 1.0,
      "sse_event_count": 0,
      "subject": "runtime",
      "timings": {
        "wall_time_ms": 440.15
      }
    }
  ],
  "generated_at": "2026-08-22T06:19:27.328806+00:00",
  "subject": "runtime",
  "suite_id": "workspace_context",
  "summary": {
    "case_count": 1,
    "failed_count": 0,
    "passed": true,
    "passed_count": 1,
    "score": 1.0
  }
}