{
  "cases": [
    {
      "case_id": "health_contract",
      "error": null,
      "fixture_index": {
        "mail": {
          "account_ids": [],
          "messages_by_external_id": {}
        },
        "matters": {
          "matter_ids": []
        },
        "workspaces": []
      },
      "log": {
        "exists": false,
        "json_parse_errors": [],
        "missing_sections": [],
        "path": null
      },
      "metrics": [
        {
          "details": {
            "error": null
          },
          "name": "no_runtime_error",
          "passed": true,
          "score": 1.0,
          "weight": 2.0
        },
        {
          "details": {
            "missing": []
          },
          "name": "output_contains_all",
          "passed": true,
          "score": 1.0,
          "weight": 2.0
        },
        {
          "details": {
            "tool_event_count": 0
          },
          "name": "tool_success_rate",
          "passed": true,
          "score": 1.0,
          "weight": 1.0
        },
        {
          "details": {
            "actual": 0,
            "maximum": 0
          },
          "name": "schema_rejection_count",
          "passed": true,
          "score": 1.0,
          "weight": 1.0
        },
        {
          "details": {
            "actual": 0,
            "maximum": null
          },
          "name": "llm_call_count",
          "passed": true,
          "score": 1.0,
          "weight": 1.0
        },
        {
          "details": {
            "actual": 0,
            "maximum": null
          },
          "name": "reported_token_total",
          "passed": true,
          "score": 1.0,
          "weight": 1.0
        },
        {
          "details": {
            "actual": 424.67,
            "maximum": 2000
          },
          "name": "wall_time_ms",
          "passed": true,
          "score": 1.0,
          "weight": 1.0
        }
      ],
      "name": "health_contract",
      "passed": true,
      "request": {
        "session_id": "eval_capabilities_health_contract",
        "user_input": "Check health."
      },
      "result": {
        "operation": "health",
        "output": {
          "service": "local-knowledge-agent-os",
          "status": "ok",
          "version": "0.1.0"
        }
      },
      "score": 1.0,
      "sse_event_count": 0,
      "subject": "runtime",
      "timings": {
        "wall_time_ms": 424.67
      }
    },
    {
      "case_id": "capability_catalog_contract",
      "error": null,
      "fixture_index": {
        "mail": {
          "account_ids": [],
          "messages_by_external_id": {}
        },
        "matters": {
          "matter_ids": []
        },
        "workspaces": []
      },
      "log": {
        "exists": false,
        "json_parse_errors": [],
        "missing_sections": [],
        "path": null
      },
      "metrics": [
        {
          "details": {
            "error": null
          },
          "name": "no_runtime_error",
          "passed": true,
          "score": 1.0,
          "weight": 2.0
        },
        {
          "details": {
            "missing": []
          },
          "name": "output_contains_all",
          "passed": true,
          "score": 1.0,
          "weight": 2.0
        },
        {
          "details": {
            "actual": [
              "claude_code",
              "codex",
              "extract_tasks",
              "mail",
              "matter",
              "organize_files",
              "runtime",
              "summarize_folder"
            ],
            "missing": []
          },
          "name": "capabilities_include",
          "passed": true,
          "score": 1.0,
          "weight": 1.0
        },
        {
          "details": {
            "tool_event_count": 0
          },
          "name": "tool_success_rate",
          "passed": true,
          "score": 1.0,
          "weight": 1.0
        },
        {
          "details": {
            "actual": 0,
            "maximum": 0
          },
          "name": "schema_rejection_count",
          "passed": true,
          "score": 1.0,
          "weight": 1.0
        },
        {
          "details": {
            "actual": 0,
            "maximum": null
          },
          "name": "llm_call_count",
          "passed": true,
          "score": 1.0,
          "weight": 1.0
        },
        {
          "details": {
            "actual": 0,
            "maximum": null
          },
          "name": "reported_token_total",
          "passed": true,
          "score": 1.0,
          "weight": 1.0
        },
        {
          "details": {
            "actual": 408.353,
            "maximum": 2000
          },
          "name": "wall_time_ms",
          "passed": true,
          "score": 1.0,
          "weight": 1.0
        }
      ],
      "name": "capability_catalog_contract",
      "passed": true,
      "request": {
        "session_id": "eval_capabilities_capability_catalog_contract",
        "user_input": "List capabilities."
      },
      "result": {
        "operation": "capabilities",
        "output": {
          "capabilities": [
            {
              "name": "mail",
              "requires_confirmation": false,
              "risk": "low_to_medium",
              "type": "tool_package"
            },
            {
              "name": "matter",
              "requires_confirmation": false,
              "risk": "low_to_medium",
              "type": "tool_package"
            },
            {
              "name": "runtime",
              "requires_confirmation": false,
              "risk": "low",
              "type": "tool_package"
            },
            {
              "name": "summarize_folder",
              "requires_confirmation": false,
              "risk": "low",
              "type": "native_skill"
            },
            {
              "name": "extract_tasks",
              "requires_confirmation": false,
              "risk": "low",
              "type": "native_skill"
            },
            {
              "name": "organize_files",
              "requires_confirmation": true,
              "risk": "medium",
              "type": "native_skill"
            },
            {
              "name": "claude_code",
              "requires_confirmation": true,
              "risk": "medium",
              "type": "expert_tool"
            },
            {
              "name": "codex",
              "requires_confirmation": true,
              "risk": "medium",
              "type": "expert_tool"
            }
          ]
        }
      },
      "score": 1.0,
      "sse_event_count": 0,
      "subject": "runtime",
      "timings": {
        "wall_time_ms": 408.353
      }
    }
  ],
  "generated_at": "2026-08-22T06:19:28.672946+00:00",
  "subject": "runtime",
  "suite_id": "capabilities",
  "summary": {
    "case_count": 2,
    "failed_count": 0,
    "passed": true,
    "passed_count": 2,
    "score": 1.0
  }
}